{
  "$schema": "https://jboix.github.io/evalmark/schema/result.v1.json",
  "version": 1,
  "suite": "dashboard-agent",
  "startedAt": "2026-10-08T10:00:00Z",
  "durationMs": 212000,
  "labels": {
    "model": "gemini-3.8-flash",
    "provider": "google"
  },
  "cases": [
    {
      "id": "http-errors-by-route",
      "title": "HTTP errors by route",
      "description": "A time series of the 5xx rate, one line per route.",
      "input": "Show me the HTTP error rate by route over the last day",
      "tags": ["prometheus", "timeseries"],
      "checks": [
        {
          "id": "built",
          "description": "A dashboard was built"
        },
        {
          "id": "query-runs",
          "description": "Every panel's query runs without an error"
        },
        {
          "id": "grouped-by-route",
          "description": "The panel has one series per route"
        }
      ],
      "trials": [
        {
          "status": "pass",
          "score": 1,
          "durationMs": 41000,
          "usage": {
            "inputTokens": 12400,
            "outputTokens": 910,
            "costUsd": 0.0041
          },
          "checks": [
            {
              "id": "built",
              "pass": true
            },
            {
              "id": "query-runs",
              "pass": true
            },
            {
              "id": "grouped-by-route",
              "pass": true
            }
          ],
          "output": "Built a dashboard with one panel: the 5xx rate by route over 24 hours.",
          "transcript": [
            {
              "role": "system",
              "content": "You build dashboards from the user's data sources. Plan before you write a panel."
            },
            {
              "role": "user",
              "content": "Show me the HTTP error rate by route over the last day",
              "at": "2026-10-08T10:00:01Z"
            },
            {
              "role": "assistant",
              "content": "I will look for a source with HTTP metrics.",
              "at": "2026-10-08T10:00:04Z",
              "usage": {
                "inputTokens": 2100,
                "outputTokens": 60
              },
              "toolCalls": [
                {
                  "id": "call-1",
                  "name": "list_sources",
                  "input": {},
                  "output": [
                    {
                      "id": "prom",
                      "kind": "prometheus"
                    },
                    {
                      "id": "pg",
                      "kind": "postgres"
                    }
                  ],
                  "durationMs": 120
                }
              ]
            },
            {
              "role": "assistant",
              "at": "2026-10-08T10:00:09Z",
              "toolCalls": [
                {
                  "id": "call-2",
                  "name": "run_query",
                  "input": {
                    "source": "prom",
                    "query": "sum by (route) (rate(http_requests_total{status=~\"5..\"}[5m])) / sum by (route) (rate(http_requests_total[5m]))"
                  },
                  "output": {
                    "series": 6,
                    "points": 1728
                  },
                  "durationMs": 340
                },
                {
                  "id": "call-3",
                  "name": "write_panel",
                  "input": {
                    "title": "5xx rate by route",
                    "type": "timeseries",
                    "unit": "percent"
                  },
                  "output": {
                    "panel": "p1"
                  },
                  "durationMs": 15
                }
              ]
            },
            {
              "role": "assistant",
              "content": "The dashboard shows the 5xx rate of each of the 6 routes over the last 24 hours.",
              "at": "2026-10-08T10:00:41Z",
              "usage": {
                "inputTokens": 10300,
                "outputTokens": 850,
                "costUsd": 0.0041
              }
            }
          ]
        },
        {
          "status": "pass",
          "score": 1,
          "durationMs": 38000,
          "usage": {
            "inputTokens": 11800,
            "outputTokens": 870,
            "costUsd": 0.0039
          },
          "checks": [
            {
              "id": "built",
              "pass": true
            },
            {
              "id": "query-runs",
              "pass": true
            },
            {
              "id": "grouped-by-route",
              "pass": true
            }
          ]
        }
      ]
    },
    {
      "id": "orders-per-day",
      "title": "Orders per day",
      "input": "How many orders did we get each day this month?",
      "tags": ["postgres", "bar"],
      "checks": [
        {
          "id": "built",
          "description": "A dashboard was built"
        },
        {
          "id": "daily-buckets",
          "description": "The query groups by day"
        }
      ],
      "trials": [
        {
          "status": "pass",
          "score": 1,
          "durationMs": 29000,
          "usage": {
            "inputTokens": 9100,
            "outputTokens": 640,
            "costUsd": 0.003
          },
          "checks": [
            {
              "id": "built",
              "pass": true
            },
            {
              "id": "daily-buckets",
              "pass": true
            }
          ]
        },
        {
          "status": "fail",
          "score": 0.5,
          "durationMs": 33000,
          "usage": {
            "inputTokens": 9900,
            "outputTokens": 700,
            "costUsd": 0.0033
          },
          "checks": [
            {
              "id": "built",
              "pass": true
            },
            {
              "id": "daily-buckets",
              "pass": false,
              "message": "The query groups by created_at itself, not by date_trunc('day', created_at)."
            }
          ],
          "output": "Built a bar chart of orders, one bar per order time.",
          "transcript": [
            {
              "role": "user",
              "content": "How many orders did we get each day this month?"
            },
            {
              "role": "assistant",
              "toolCalls": [
                {
                  "id": "call-1",
                  "name": "describe_source",
                  "input": {
                    "source": "pg",
                    "table": "orders"
                  },
                  "output": {
                    "columns": [
                      {
                        "name": "id",
                        "type": "bigint"
                      },
                      {
                        "name": "created_at",
                        "type": "timestamptz"
                      },
                      {
                        "name": "total_cents",
                        "type": "integer"
                      }
                    ]
                  }
                },
                {
                  "id": "call-2",
                  "name": "run_query",
                  "input": {
                    "source": "pg",
                    "sql": "select created_at, count(*) from order where created_at >= date_trunc('month', now()) group by 1"
                  },
                  "error": "relation \"order\" does not exist"
                }
              ]
            },
            {
              "role": "assistant",
              "content": "The table is called orders. I will fix the query.",
              "toolCalls": [
                {
                  "id": "call-3",
                  "name": "run_query",
                  "input": {
                    "source": "pg",
                    "sql": "select created_at, count(*) from orders where created_at >= date_trunc('month', now()) group by 1"
                  },
                  "output": {
                    "rows": 1843
                  }
                },
                {
                  "id": "call-4",
                  "name": "write_panel",
                  "input": {
                    "title": "Orders per day",
                    "type": "bar"
                  },
                  "output": {
                    "panel": "p1"
                  }
                }
              ]
            },
            {
              "role": "assistant",
              "content": "The dashboard shows the orders of this month."
            }
          ]
        }
      ]
    },
    {
      "id": "slowest-queries",
      "title": "Slowest database queries",
      "input": "Which queries are the slowest on the main database?",
      "tags": ["postgres", "table"],
      "checks": [
        {
          "id": "built",
          "description": "A dashboard was built"
        }
      ],
      "trials": [
        {
          "status": "error",
          "durationMs": 60000,
          "usage": {
            "inputTokens": 4200,
            "outputTokens": 120,
            "costUsd": 0.0012
          },
          "error": "The model call timed out after 60 s."
        },
        {
          "status": "pass",
          "score": 1,
          "durationMs": 35000,
          "usage": {
            "inputTokens": 8700,
            "outputTokens": 590,
            "costUsd": 0.0028
          },
          "checks": [
            {
              "id": "built",
              "pass": true
            }
          ]
        }
      ]
    },
    {
      "id": "cost-by-team",
      "title": "Cloud cost by team",
      "input": "Break down last month's cloud cost by team",
      "tags": ["http"],
      "trials": [
        {
          "status": "skip",
          "output": "The billing API is not configured in this environment."
        },
        {